{
  "schemaVersion": "audit-event/1",
  "sequence": "43",
  "tenantId": "019a0000-0000-7000-8000-000000000030",
  "agentId": "019a0000-0000-7000-8000-000000000001",
  "actor": {
    "kind": "executor"
  },
  "traceId": "4bf92f3577b34da6a3ce929d0e0e4736",
  "type": "policy.denied",
  "occurredAt": "2026-10-01T12:00:00.000Z",
  "payload": {
    "reason": "POLICY_DENIED",
    "rule": "maxSlippageBps"
  },
  "runId": "019a0000-0000-7000-8000-000000000032",
  "intentId": "019a0000-0000-7000-8000-000000000033"
}
