{
  "schemaVersion": "audit-event/1",
  "sequence": "42",
  "tenantId": "019a0000-0000-7000-8000-000000000030",
  "agentId": "019a0000-0000-7000-8000-000000000001",
  "actor": {
    "kind": "user",
    "id": "019a0000-0000-7000-8000-000000000031"
  },
  "traceId": "4bf92f3577b34da6a3ce929d0e0e4736",
  "type": "deployment.stateChanged",
  "occurredAt": "2026-10-01T12:00:00.000Z",
  "payload": {
    "from": "pending",
    "to": "active",
    "generation": 1
  }
}
